,Unnamed: 0,index,id,subreddit.id,subreddit.name,subreddit.nsfw,created_utc,body,sentiment,label,label_clean,created_datetime
32,32,32,cktidn5,2qh1i,askreddit,False,1411771866,"The effect of ISIS is immediate and obvious. You can't deny seeing someone gun down people in the street or behead someone on YouTube... Whereas with climate change, while there is data out there, it's not like people are seeing immediate, directly-attributable effects (even if they are like the drought in the midwest or fires on the west coast due to drought, they are convinced it's just the ""weather"" and it'll pass). Climate change is a slow, evolving process and I think people are kind of tempered to it... Like cooking a frog by slowly turning up the heat rather than dropping into boiling water. ",0.64,"""climate opinion critique""",climate opinion critique,2014-09-26 22:51:06
45,45,45,d21yy0o,2qh1i,askreddit,False,1460595770,"Environmental issues like climate change and deforestation. I guess the mindset is that people won't care until it personally affects them, which is really sad.",-0.5455,"""Climate nihilism critique""",climate nihilism critique,2016-04-14 01:02:50
51,51,51,f27wgvw,2qh1i,askreddit,False,1570047538,"To expand, they will hate that we knew about it since the late '70's, and did nothing and in many instances, actively worked against it. Just like my generation wondered how the likes of Hitler, Stalin and Pol Pot could come into power, future generations will wonder why we did not address climate change in a timely manner. They won't be talking about the unemployment rate, economic growth or affordability of housing in this decade. They'll be talking about how criminal it was for us not to have taken climate change seriously.",-0.0516,"""climate change importance""",climate change importance,2019-10-02 20:18:58
66,66,66,es2eu59,2qh1i,askreddit,False,1561522048," I've been really fucking terrified of what will happen in 10-20 years with climate change. I have almost zero hope humans can work it out. Anytime I talk with my partner about having children, saving for a home or all the other western/adult ideas, it seems like what's the point?",-0.1153,"""climate opinion critique""",climate opinion critique,2019-06-26 04:07:28
103,103,103,feq311s,2qh1i,askreddit,False,1579336877,"The Y2K scare and its non-dramatic outcome is often used nowadays as a scare story to counter, e.g. the effects of climate change. What people overlook is that Y2K didn't happen because people acted to prevent it, not because it was a scare story.",-0.8591,climate change importance,climate change importance,2020-01-18 08:41:17
109,109,109,e4p3nj5,2qh1i,askreddit,False,1535037161,Nah. Kids 200 years from now will have it worse as far as climate change goes. We aren't gonna fox the problem.,-0.7351,Climate nihilism,climate nihilism,2018-08-23 15:12:41
110,110,110,d9x8csv,2qh1i,askreddit,False,1478964962,"This thread is full of people downvoting climate change deniers and upvoting dumb jokes, therefore negating the point of this thread which is to see why people deny climate change. Don't punish people for giving their opinion when asked. For those who want an actual answer, sort this thread's comments by Controversial, because that's where the real climate change deniers will be.",-0.498,Not climate opinion,not climate opinion,2016-11-12 15:36:02
132,132,132,dicf4y0,2qh1i,askreddit,False,1496366820,Or it will lead to migration for work and better agricultural land which has happened countless times in history and will happen again regardless of climate change.,0.4404,Climate apathy,climate apathy,2017-06-02 01:27:00
147,147,147,i08j4qx,2qh1i,askreddit,False,1647004664,Climate change,,Not climate opinion,not climate opinion,2022-03-11 13:17:44
151,151,151,edt2tcl,2qh1i,askreddit,False,1547216490,"It's important to remember that scientists are often wrong in at least some aspect of their assertions, if not the whole premise. This is especially so in the softer, non-laboratory sciences. Scientists will tend to defend their research and associated biases as strongly as any person defends their beliefs. Climate change is a fact. Human contribution is a fact. The degree, progression, short and long term consequences, reasonable action are all human assertions based on interpretation of those facts. While the climate trend is pretty well established, the consequences have consistently fell short of media carried predictions. This topic was politicized early on, by the left, by non-Scientists for political gain and that always taints a concept for people. Anyone that makes specific dire 'predictions' had better get it right. If they don't, they've damaged the whole effort. There are many scientists of all political persuasions that rightly take a very careful approach to predicting consequences, but that doesn't sell news so they get ignored.",0.362,climate opinion critique,climate opinion critique,2019-01-11 14:21:30
176,176,176,e7phke0,2qh1i,askreddit,False,1539458948,"All I see are people giving completely unfounded anecdotal suppositions about the weather changes near their house, and assigning the cause to man-made climate change with no data, citations, or evidence. Hell, one person even said the bugs seem bigger these days. You call this science? ",-0.6597,Climate denial,climate denial,2018-10-13 19:29:08
186,186,186,ddiki0n,2qh1i,askreddit,False,1486608457,"The Flood, the newest climate change documentary by Nat. Geographic I think? It's free on youtube to watch!",0.5562,Climate information,climate information,2017-02-09 02:47:37
191,191,191,d28gaud,2qh1i,askreddit,False,1461036603,"""Climate Change is not affected by human activity.""",0.1139,Climate denial,climate denial,2016-04-19 03:30:03
193,193,193,f6111dx,2qh1i,askreddit,False,1572630603,Actually you hear about it more now because PGE spends billions annually appeasing climate change extremists and as a result they neglect safety features which have caused California to burn down every year,0.2023,Climate action critique,climate action critique,2019-11-01 17:50:03
223,223,223,d9lzojz,2qh1i,askreddit,False,1478290603,"More honest ones, too. Those graphs that are plastered all over every single piece of climate change literature I've ever seen are misleading at best. Yes, it's true that humans are most likely altering the Earth's climate and that the consequences could be catastrophic, but 150 years of instrument temperature records are not remotely close to being enough to show a meaningful trend. Statements like ""2016 is the hottest year on record"" are similarly misleading. Yes, it's the hottest year in the 150 years worth of temperature data we have, but it's such a minuscule data set that the fact that it's the hottest out of it is pretty much irrelevant to everything. Most people haven't been educated enough to really understand climate change, but most are smart enough to tell when they're being manipulated. If we want to end the denialism, we ought to start with education and leave out the manipulation and fear mongering.",0.7943,Climate denial critique,climate denial critique,2016-11-04 20:16:43
249,249,249,higjv81,2qh1i,askreddit,False,1635471891,Far too few people in the AU tourism industry at the Great Barrier Reef acknowledge climate change.,0.5574,climate policy critique,climate policy critique,2021-10-29 01:44:51
262,262,262,h9oaqi7,2qh1i,askreddit,False,1629474338,"Without any adverse nuclear or astronomical events, and at the current rate, I can see the effects of climate change eventually wipe out humanity.",0.2755,climate action critique,climate action critique,2021-08-20 15:45:38
281,281,281,grtx9dv,2qh1i,askreddit,False,1616432729,Right winger but I'm all for going electric. I believe it should be done through nuclear energy now that we've learned so much more about it and have moved away from uranium. I believe climate change won't stop even if we reach net zero just due to the world changing but I'm all for cleaner air and efficiency. I don't think we should ban coal tomorrow and call it a solution but a gradual step away from fossil fuels through incentives would be ideal.,0.872,Climate optimism,climate optimism,2021-03-22 17:05:29
299,299,299,h8n10mq,2qh1i,askreddit,False,1628764981,Climate change is real.,,Climate information,climate information,2021-08-12 10:43:01
312,312,312,gy5c9x9,2qh1i,askreddit,False,1621027858,The Happening. Splendid ode to 50s horror movies and a kid gets his head blown off and it had real suspense (that actually could be explained as climate change as malaria mosquitos are getting used to colder climates so that trees would mutate isn't that crazy).,-0.3182,climate change importance,climate change importance,2021-05-14 21:30:58
344,344,344,i9a3m52,2qh1i,askreddit,False,1653013780,"This is a complete aside, but your comment made me have a flashback to my university's ""introduction to earth science"" class. One of the very first questions in the very first lab is an exercise to teach the students that the earth's orbital proximity to the sun isn't even what controls the seasons-- In the northern hemisphere, the earth is actually closest to the sun in the middle of winter. I knew that the material included a lot of content about how to understand climate change, but I never realized that question was part of it!",0.0,Climate Information,climate information,2022-05-20 02:29:40
366,366,366,hd4wypc,2qh1i,askreddit,False,1631831063,Running a fossil fuel company and blaming consumers for climate change.,-0.4939,Climate denial critique,climate denial critique,2021-09-16 22:24:23
372,372,372,id93cvp,2qh1i,askreddit,False,1655861411,That the negative impacts of climate change will be huge,-0.34,climate anxiety,climate anxiety,2022-06-22 01:30:11
374,374,374,eyrmamt,2qh1i,askreddit,False,1567372310,Can you tell that the rocks are cooking? It's a climate change oriented campaign.,0.0,Not Climate Opinion,not climate opinion,2019-09-01 21:11:50
375,375,375,cef76pm,2qh1i,askreddit,False,1388632632,Meanwhile they're doing everything they can to PREVENT THE RAPID IMPLEMENTATION OF RENEWABLES ON A MASS SCALE as well as SERIOUS regulations on fossil fuels to head off catastrophic climate change. Don't whitewash their bullshit. The amount these companies spend on renewables in relation to their profits and the amount they spend on more nefarious operations is peanuts.,0.5571,Climate action critique,climate action critique,2014-01-02 03:17:12
385,385,385,fc3fp01,2qh1i,askreddit,False,1577388776,"If they were really doibg their part to save the species they would be fighting against climate change, not contributing to overpopulation. I see where you're coming from, but implying that someone is doing the world a service by having children is out ludicrous. Not trying to imply that people having children is a bad thing, and I'm not trying to say that you shouldn't try to accommodate your friends/family who have kids. I just don't think it should be expected.",-0.8248,climate opinion critique,climate opinion critique,2019-12-26 19:32:56
436,436,436,dr7v3j5,2qh1i,askreddit,False,1513214647,Denying man-made climate change.,-0.34,Climate Denial,climate denial,2017-12-14 01:24:07
457,457,457,c3on55y,2qh1i,askreddit,False,1328590401,"but thats the point of the carbon economy, it i supposed to provide a financial incentive for being more economically friendly, especially for people that think that there is no problem. It is designed to push for innovation, CLEAN innovation. How long have we had solar technology, wind etc been around? It's almost never applied.... why? IT DOESN'T MAKE ECONOMIC SENSE!!! So we first burn all the coal first? because it's cheap? Look around the world, without carbon pricing the innovation will be invented overseas. To compare the sun, and wind to resources is bazaar. I think you know better. Everything physical thing between the north pole to the south pole has a number (quantity) if that is a myth, maybe the world is flat and goes on forever. It's not wacky left wing propaganda it's real, everything has a measurable quantity tell me gold, arable land, oil, coal copper, iron ore, precious stone, fresh water etc. that these things are infinite? yeah maybe over a few million years. I really think your in denial, and are detached from the nature of what we are doing. You can justify most of our resources being renewable, but we don't have the millions of years it takes for the earth the provide again. What you said about species is almost suggesting if we become extinct and take a whole lot of species with us, it's ok, because nature will recover eventually. You need to admit why your against this, I think it's because a carbon tax is going to make your living expenses a fraction more expensive. Forget about global warming, climate change is happening, this winter all over the world has been unusual, that's not propaganda. I don't want to slander cause I know your an optimist but, it's hard not too. Stay on the internet, watch what is happening around the world, and you should be at least be open to the possibility of being wrong. Good luck. ",0.9943,Climate denial critique,climate denial critique,2012-02-07 04:53:21
461,461,461,eo3sfas,2qh1i,askreddit,False,1558256556,"As an individual? Recycling, reducing or cutting non-biodegradable waste, saving power/water wherever possible, voting for leaders who are invested in stopping climate change (read: saving us from extinction), and donating to or volunteering with eco-organisations. At the sheer scale climate change is already affecting us (and will continue to escalate) only a coordinated effort on a national and multinational scale will even begin be able to slow down or stop the effects of runaway climate change. We've been ignoring the growing snowball for so long that it'll take entire nations working together to stop it at this point.",-0.8519,Climate Activism,climate activism,2019-05-19 09:02:36
484,484,484,dodk8jk,2qh1i,askreddit,False,1508023328,Sorry how's that relevant to what I said about climate change?,-0.0772,Climate denial critique,climate denial critique,2017-10-14 23:22:08
497,497,497,ebvkwwr,2qh1i,askreddit,False,1544918689,"I'm surprised I had to scroll down this far to find this. The whole institutionalized lying scheme about Santa is creepy as fuck and teaches not one good notion to kids. It's a difficult and increasingly dangerous world and kids face a lot of tough decisions in their future (AI, climate change, antibiotic resistance) and instead of teaching them something concrete or objective, we teach them a lie instead because we think it's cute.",-0.8887,Not climate opinion,not climate opinion,2018-12-16 00:04:49
507,507,507,ftdpbjh,2qh1i,askreddit,False,1591632130,"Does the fire department say ""All houses matter"" when you dial 911 and say yours is on fire? Does your dentist says ""All teeth matter"" when you want to discuss the one in agony and in need of a root canal right now? Do you tell a ""Save the Whales"" charity ""Uh, actually all mammals matter""? When the news broadcasts about Amazon forest destruction, do you pipe in and say ""All forests matter""? When people discuss climate change and saving the Earth, do you say ""All planets matter""? You're not literally wrong, you're either just missing the point entirely or deliberately acting out against it.",-0.5277,Not Climate Opinion,not climate opinion,2020-06-08 16:02:10
519,519,519,id6mu7q,2qh1i,askreddit,False,1655820800,Was forced to read a book about the environment in university - the book was well written so I actually began caring abojt climate change and stuff,0.3182,"""climate activism""",climate activism,2022-06-21 14:13:20
529,529,529,eeyzyi2,2qh1i,askreddit,False,1548458893,"Long before that, though, humanity will suffer negative effects from climate change. And if you believe we're spiritually compelled ""stewards of the earth"" then there is no time to wait (we're here on God's time to do his will).",-0.8481,climate activism,climate activism,2019-01-25 23:28:13
543,543,543,ey5f80x,2qh1i,askreddit,False,1566830160,"As a UK lad, the hopes of snow. We don't seem to get it anymore because of climate change. I'm still a child at heart and I love snow.",0.9042,"""climate anxiety""",climate anxiety,2019-08-26 14:36:00
546,546,546,cjiap0t,2qh1i,askreddit,False,1407305480,"Well, they are rational, but they are terrorist. Think of terrorists like trolls, and you can figure out what they'd probably do: nuke a big country. You have to expect, though, that they'd think this through at least a couple of steps. (Keep in mind that it's not a suicide bomber that runs ISIS, he's effectively a rogue general.) So, you better believe that they are going to weigh a country's response. And they are going to consider the global climate. You are correct that nuclear proliferation is still a debatable and scary topic. That, however doesn't change the fact that (so far) all nuclear missiles are in the hands of rational actors, and that they are convinced that nuclear war is not favorable to themselves. Edit to add: Keep in mind that the Quran is a law book as well as a religion. Abu Musab al-Zarqawi's goal, remember, is to establish Islam as the government of Iraq (well, that and kill the Shi'a). Would that be a success if he used nuclear weapons?",-0.8517,Not climate opinion,not climate opinion,2014-08-06 06:11:20
550,550,550,c8jrb72,2qh1i,askreddit,False,1361548260,"Atmospheric physicist here: No, sorry, the weather man is not wrong because he's stupid, uneducated, lying, lazy, incompetent, etc. A meteorologist has to deal with global climate models (GCM's) and GCM's are not very accurate. Trying to build a climate model means we have to resolve lots of scales from 1000's of kilometers in the jet stream to milimeters in turbulence. It's damn hard to build a model to do that that doesn't take up more computational power than exists. Imagine designing a billboard that is all black except for one square inch where you need a high-res picture of this. but we do need lots of pixels to resolve that picture of Woodstock. Now imagine a billboard the size of the US with millions of those little pictures scattered all over it. We still have mostly black but now we have to resolve all those little pictures. And we need to process and store that image. And we need to repeatedly change that image because those little pictures move. And now not only to do we need to resolve and process that image, but we need to make predictions on how those little pictures move - that is climate modeling. There are vast swaths of large-scale structures, like a jet stream, but there are billions of small-scale structures that affect the overall ""picture"" of the present climate such as wind, pollution (even a plume from a single smoke-stack can have far-reaching effects), waves (density internal waves), and turbulence that have a significant affect on the large-scale structures. Just as processing a gigantic photo that has super-high resolution in some spots would be a monstrous task, producing an accurate GCM _every day_ is simply something even our super computers don't do very well (I run my sims on the Canadian super computer and they usually take a week, and I'm not even running a GCM nor super high res). tl;dr cut your meteorologist a friggin break. If you want to complain, file that complain on a check made out to your local university's physics, math, environmental engineering, or atmospheric and ocean science department.",0.7401,Climate Information,climate information,2013-02-22 15:51:00
553,553,553,f93lc0v,2qh1i,askreddit,False,1575061958,"Tourists freezing in shorts, flip flops and recently purchased SF sweatshirts is a thing, particularly in the sunset. Although now thanks to climate change it is starting to get hotter.",0.0258,Climate Information,climate information,2019-11-29 21:12:38
576,576,576,fl02rqe,2qh1i,askreddit,False,1584689160,"Elder people giving their opinion on everything while acting very smart, but most of the time they don't even know the words they used. Climate change is an interesting subject if you want people to talk about how china and russia manipulate the world economy",0.7715,Climate denial critique,climate denial critique,2020-03-20 07:26:00
585,585,585,e3gnx4j,2qh1i,askreddit,False,1533198092,More of the same shit. People didn't understand global warming and refuted it. Then it was changed to climate change. People still don't understand and still refute it.,-0.6179,Climate Denial Critique,climate denial critique,2018-08-02 08:21:32
603,603,603,dylzq07,2qh1i,askreddit,False,1525732831,"I am as confused as you are on this matter. Even if you don't believe in climate change, shouldn't we still be striving to be good stewards of this planet? It is the only one we have \(for now anyway\) so it would behoove us to keep it in operating order!",0.254,Climate denial critique,climate denial critique,2018-05-07 22:40:31
607,607,607,i8aghbf,2qh1i,askreddit,False,1652339332,"Don't care. Don't care about climate change, or what that girl said, or what that guy did at lunch. Just don't care. If you don't care you won't stress.",-0.5183,Climate apathy,climate apathy,2022-05-12 07:08:52
626,626,626,epyly1f,2qh1i,askreddit,False,1559642653,"I agree, but this is an order of magnitude beyond that. Those kids can go home, play with their friends, and live a normal life after the protests. This girl will never be able to do that. Earlier today I saw a photo of some demonstrators in Denmark, one of them holding a sign reading ""GRETA THUNBERG IS MY RELIGION"". This isn't furthering the fight against climate change, this is just turning a hapless kid into a hero figure. It's objectifying in a way that goes beyond even dressing her in a bikini and parading her before some ""judges"" would have been.",0.9047,Climate action critique,climate action critique,2019-06-04 10:04:13
647,647,647,eo6xa3f,2qh1i,askreddit,False,1558327875,"About 2000x a day somebody posts the copy past, ""climate change is the fault of 100 corporations..."" schtick. AOC is prime Captain Planet age. Lots of very loud and very stupid people ruining environmentalism.",-0.8251,climate opinion critique,climate opinion critique,2019-05-20 04:51:15
728,728,728,fmdaoh3,2qh1i,askreddit,False,1585963184,"Well the green new deal wants to ban fossil fuels and nuclear in 10 YEARS! You see why I'm saying it's unrealistic? We need to do what we can, but we can't go to the extreme. Some damage will happen. We can't stop climate change completely",-0.8611,"""climate policy critique""",climate policy critique,2020-04-04 01:19:44
729,729,729,hi32c3y,2qh1i,askreddit,False,1635229847,"Night vision, for when we're all living in caverns underground after climate change makes the surface uninhabitable.",0.25,Climate nihilism,climate nihilism,2021-10-26 06:30:47
740,740,740,gdrsf5e,2qh1i,askreddit,False,1606490997,That climate change is inevitable. The technology we have for a 'sustainable' future isn't feasible.,0.0,Climate Nihilism,climate nihilism,2020-11-27 15:29:57
751,751,751,f211sbf,2qh1i,askreddit,False,1569866793,"I live carless and eat minimal meat because it reduces my carbon footprint, and am aiming to invest in enough carbon offsets to make my lifetime net carbon footprint zero within the next 2 years. Most of my clothes were purchased used and/or made of long-lifespan natural fibers (cotton, linen, wool). I am currently living in a region with the lowest per capita greenhouse emissions in the US per capita (under 5T, depending on your source -- about the same as France). Those steps are small measures relatively, but they are positive. But that's not enough: most of our emissions come from fossil fuels burned for electricity or transportation. These are industrial scale processes and individuals cannot directly choose how their utilities do business. What does your argument have to do with solving that problem? My take: your argument sets an impossible standard for climate activists in many areas where going carless is not an option for everyday life. It also dodges taking action about the real sources of most greenhouse emissions: big utility companies, car manufacturers, and industrial emitters. Putting the onus on individuals rather than emitters is a way to let those responsible for this problem off the hook by portraying activists as hypocrites for anything they do which isn't perfect. Prove me wrong? Edit: Silence, I see. That really says it all: it was never about whether or not climate change activists live their beliefs, but about whether or not you could find an excuse to denigrate said beliefs. People who don't contribute to anything meaningful often find satisfaction in trying to cut down those who do. After all, it is much easier to criticize than to do something.",-0.7436,climate activism,climate activism,2019-09-30 18:06:33
757,757,757,f03qhj1,2qh1i,askreddit,False,1568365987,"We are due for then economic bubble to burst soon so theres that. I personally believe that due to climate change and how screwed we already are that there is going to at some point be an overwelming amount of refugees coming in. I think that at some point we are going tp have another civil war, mainly due to the blm stuff but I think muslims and Christians will duke it out as well. I think due to that Marshall law will be put in place for a while. And honestly its my personal opinion that eventualy the u.s. and Russia will become very strong allies.",0.8397,Climate Nihilism,climate nihilism,2019-09-13 09:13:07
