,Unnamed: 0,index,id,subreddit.id,subreddit.name,subreddit.nsfw,created_utc,body,sentiment,label,label_clean,created_datetime
12432,12432,10585,fvdz1xb,2qh1i,askreddit,False,1592608486,"Ok I'll bite: 1. Trump does not take global climate change seriously and believes it is a hoax, while every credible scientist in every credible research institution is screaming at the top of their lungs that our window for avoiding catastrophic climate change is now about 10 years. Four more years of inaction either means we won't be tackling it meaningfully, or that measures we do take will have to be more extreme 2. Democracy in the world is in decline, and Trump does not care about maintaining alliances, adhering to American values, or promoting human rights worldwide. This inaction by him is all wanna be dictators need to point to in their countries to say ""hey look if America is abusing its people, we can too"" 3. Trump ignores bad news or pretend it doesn't exist. He has turned a blind eye to the problems that plague American society, like affordable healthcare, affordable education, infrastructure, and income and wealth inequality. For all you history buffs out there, you know that inequality is precisely what causes empires to unravel. Trump is so corrupt that he funnels taxpayer money straight into his and his friends' pockets at every opportunity he can. 4. Trump's scientific illiteracy is literally killing Americans. No other country in the world is politicizing science like Trump and Republicans in this country are. This is why countries who listened to their scientists are largely done with the first wave of COVID, but scientific ignorance broadcasted by the president himself causes people to be skeptical of preventative measures. This is why over 100,000 Americans are dead 5. Trump takes no responsibility for his actions or bad things that happen in his administration. This inability to learn and empathize is a deadly combination for a leader. 6. Trump is a racist and he legitimizes the racist tendencies of his followers. Hate crimes against non whites and minorities has increased substantially since he took office. This is no accident. 7. There is no accountability in the White House. Trump intimidated an allied country to try to have them investigate his political opponent. This is a clear abuse of power, and was why he was impeached. Since he was acquitted, the only thing he has learned is that members in his party will blindly support him even as he takes a proverbial shit on the US Constitution 8. Trump is compromised. Please read the Mueller report for more information on this. There is a high likelihood that he is leveraged up to his eyeballs in debt from Russian banks and oligarchs and has hidden his tax returns for this exact reason. The fact that he is so leveraged means that he is not accountable to us. If you watched the Helsinki press conference with Putin, it is impossible to come away with the impression that he isn't completely subservient to Putin, throwing US intelligence agencies under the bus We Americans deserve better. I strongly encourage anyone reading here to vote for Joe Biden this year. He's got a strong record, relevant experience, is an empathetic leader, and is smart enough to surround himself with experts and carefully consider their advice.",-0.9791,Climate denial,climate denial,2020-06-19 23:14:46
12475,12475,10628,fc74nvn,2qh1i,askreddit,False,1577497432,"It's such a shame because in the UK we hardly ever get snow apart from the highlands, nowadays if we're very lucky we'll get a week of snow but mostly it's just 1 or 2 days; climate change is properly making an impact now.",-0.0009,Climate information,climate information,2019-12-28 01:43:52
12511,12511,10664,frnus5q,2qh1i,askreddit,False,1590327623,"OK I have a story I'd love to make into an animation. In the future, humanity was wiped out by climate change, and the world is now inhabited by the fey folk (fairies), who were hiding this entire time, waiting for humans to die. There's the Seelie Court and Unseelie Court, who divided the continents between them. The cities are overgrown, with glass spires towering into the sky and trees have merged with some of them. Basically imagine a solarpunk/feypunk kind of thing. A fey woman is applying to work in the Seelie Court, one of the most prestigious jobs ever. She's worked her way up the ladder, and she has been recommended to the Seelie Queen. Her meeting with the queen goes well, and she's now working in the Court. If things go well, she may be working at the Queen's side one day. I actually have twists but I wanna see what y'all come up with.",0.4618,Climate information,climate information,2020-05-24 13:40:23
12526,12526,10679,fk2jjvo,2qh1i,askreddit,False,1583802445,Climate change!,,Climate information,climate information,2020-03-10 01:07:25
12528,12528,10681,hs9t36a,2qh1i,askreddit,False,1641941406,"So many. Don't even know where to start. It was a big shock because I expected things to be more normal and developed and civilized coming from Europe. Healthcare isn't respected as a very basic human right and it's not free but rather a privilege of the rich. Biggest shock is people being against universal healthcare when that is actually CHEAPER than the shitty system usa has. Same as education. Food in schools. I just can't understand. Wouldn't feed my animals that shit. Guns. I felt more insecure than in 3rd world countries. It's just crazy that usa let's crazy people have guns and even with all the deaths people still deny facts. Fat. I landed in usa and I see fat and overweight people all over. Like a dystopian reality when suddenly everyone got +50kg. Not using the metric system. It's just so ridiculous and stupid. Worship of the military is just insane. Discounts for military personal that spread death hate torture and misery throughout the world fighting for oil. Complete lack of respect for basic human rights and even prosecuting people that defend the public best interest like heroes like Chelsea Manning, Julian Assange, Edward Snowdon. Having Guantanamo still open. Severe lack of public transportation. Severe lack of trains. The size. Everything is crazy big. Food portions where 1 meal could feed a family for a day. Everything has to big super big where big is perceived as better when in reality just lacks quality. Cars are so big, maybe because everyone is so fat? Consume tons of gas and are incredibly slow and inefficient. Speeding police are crazy nazis. Carry a machine gun on a sidewalk? No problem. Going 1km/h over the speed limit, death penalty. Death penalty it's just fucked up. Innocents dying because mistakes were made. Everything is about money it's about business. Everything else is second. Justice, business, if you are rich you bail if you are poor you get into a for profit jail. Lobbying being legal, it's just insane. Lobbying is completely and highly illegal in most democracies. 2 party dictatorship. Like any other party doesn't matter. People being so stupid. Like voting against their own interests, flat earthers, anti vax (way before covid), climate change deniers. They virtually only exist in usa, incredibly few elsewhere. I don't know anyone. Severe lack of history and geography knowledge. The average usa citizen knows as much as a 10yo about world history here. Which is dangerous because if you don't learn history then history will repeat itself, nazis marching in the streets. Racism, I just can't even understand why it happens. Nature, stunning beautiful just amazing, the countryside the wildlife crazy beautiful scenarios. Too bad it's being all destroyed. Income inequality, richest country in the world, millions of poor people. Tons of homeless people. Just so sad. And people don't seem to care or do anything about it. And try to justify saying they don't want to work or are drug addicts. The insane fucked up focus on security, even before 9/11 so much police and military, and doesn't make any difference just makes everyone's life more miserable. The false American dream where many people think that anyone works hard he or she can succeed, like everyone has the same opportunities and starting place. Everything seems like a competition everything wants to be number 1. Sports, like indie car racing. Cars driving on an oval track I will never understand the fun. Drag racing even worse, racing? Like zero skills press something ends in seconds. Absurd. There's many other things but that's what came to my mind",-0.9979,Climate action critique,climate action critique,2022-01-11 22:50:06
12542,12542,10695,hx8417p,2qh1i,askreddit,False,1645046684,All regions on Earth will survive. what do you think climate change is going to do to the planet?,0.0,Climate information,climate information,2022-02-16 21:24:44
12580,12580,10733,i1nac4t,2qh1i,askreddit,False,1647946895,The economy. Maybe climate change.,0.0,Climate information,climate information,2022-03-22 11:01:35
12620,12620,10773,h8x4bi9,2qh1i,askreddit,False,1628954752,"I see a lot of comments saying that their answer is climate change, but they're not mentioning the #1 cause of climate change, which is animal agriculture. The amount of land that is used for animal agriculture (including crop land used to feed the animals) is entirely unnecessary and it's destroying natural biodiversity. We like to blame the governments and corporations, but you have the choice 3 times a day to decide whether or not you are going to continue to financially support a system that rapes the land and sea, but we don't even think about it. We breed like 70 BILLION land animals a year. They need to eat a lot more than we do, and they shit a lot more than we do as well. What an absolute waste, and our only remaining excuse is taste.",-0.8573,climate policy critique,climate policy critique,2021-08-14 15:25:52
12626,12626,10779,h4x1yv3,2qh1i,askreddit,False,1626096452,"First thing I do is test it. I want to know what I'm dealing with here. The way I understand it, I can basically think of stuff and with a snap of a finger I can change reality? At least that's what the movie makes it seem like. Once I am done testing, first, I get myself right. Give myself my preferred superpowers, make myself a superhuman, make myself a billionaire. This is just to get my new life started. Next, loftier goals. I fix the Earth. I fix Climate Change, do a global pollution clean-up, pull all that excess carbon out of the atmosphere... Save humanity from impending doom. I also implant the knowledge in everyone's mind that it was ME who did it. I am the savior. Should earn a few ""thanks buddy!"" walking down the street for that one lol Next, I snap into existence a safe new ""cold fusion"" reactor or something like the tony stark Arc reactor. Something that can provide tons of energy and be a clean backbone for the electrical grid. That way, we can get away from fossil fuels mostly, and start switching to renewables. I'd also create a new type of battery that holds much more power for longer, at a lighter weight. This makes EVs much more usable, and we can start making electric ships and aircraft too. Once I have pollution and energy figured out, I'll go ahead and snap Covid and other major diseases out of existence. Done with that nonsense. From here, I take a break, assess my next moves. I want to be careful because I don't want to overly control humanity. I just want to handle some major issues and let humanity move along.",0.9637,Climate information,climate information,2021-07-12 13:27:32
12654,12654,10807,hb6r66f,2qh1i,askreddit,False,1630504385,Climate change is kind of snowballing and we're going to start seeing more effects of that. No one is prepared.,-0.0772,Climate information,climate information,2021-09-01 13:53:05
12665,12665,10818,ies8qha,2qh1i,askreddit,False,1656911182,"That is not all that happened in the Supreme Court. It's just the case that has received the most media attention. West Virginia v. Environmental Protection Agency: the Supreme Court ruled that the EPA does not have regulatory authority to regulate CO2 emissions, crippling its ability to combat climate change. Decided 6-3 along partisan lines. Carson v. Making: the Supreme Court ruled that taxpayer money has to go to religious schools. Decided 6-3 along partisan lines. More importantly, however, is that the Supreme Court is not done yet. Justice Clarence Thomas in his concurring opinion overturning Rue explicitly spelled out that he also wants to overturn legal protections for contraception, same-sex marriage, and protections against anti-sodomy laws, using the same legal argument, that people do not have a Constitutional right to privacy, as was used in the decision overturning Roe. But this is, by far, the most terrifying of all: [Supreme Court to take on controversial election-law case]([URL] The Supreme Court is soon going to rule, along partisan lines, that state legislatures have complete authority over their states' elections and are not beholden to judicial review at any level. That means Republican-controlled state governments will be able to declare the winners of their states' elections, including their own elections, irrespective of how people actually voted. The country will no longer be a democracy.",0.9119,climate policy critique,climate policy critique,2022-07-04 05:06:22
12689,12689,10842,i32qk9g,2qh1i,askreddit,False,1648876059,The millennials are the ones who are going to save the world from climate change not you,0.4939,Climate information,climate information,2022-04-02 05:07:39
12694,12694,10847,i0tovdk,2qh1i,askreddit,False,1647391457,"I'm not trying to put you on blast or anything but you have me curious. You imply that you're a conservative and that your most liberal opinion is that we need to prevent climate change. What issues are so important to you that you see the severity of the climate crisis, know we have to do better, but still vote for politicians that support fossil fuels? I get some of the comments, like drug legalization and abortion, and I'm liberal as fuck so I agree with all of them, but this one in particular perplexed me. I can't imagine any way to complete the sentence ""I know that combating climate change is primarily a liberal platform and I recognize that we're destroying the planet at an alarming rate but I still vote conservative because......""",-0.0215,climate activism,climate activism,2022-03-16 00:44:17
12729,12729,10882,hlorbi7,2qh1i,askreddit,False,1637615775,"I'd like to manage the green energy transition for a large energy company or work to implement smarter climate change policies within the US or EU. Once I feel like I've done something there, I'd like to transition to a simpler job. Like work at the beach or something.",0.9349,Climate action critique,climate action critique,2021-11-22 21:16:15
12762,12762,10915,ilpr3sr,2qh1i,askreddit,False,1661422924,climate change and the inevitable collapse of civilisation in the next 30 years. i can't do a god damn thing about it and it used to make me sick thinking about it,-0.8754,Climate nihilism,climate nihilism,2022-08-25 10:22:04
12763,12763,10916,hw3o4de,2qh1i,askreddit,False,1644339013,"I said this when Bush was in office- I'd like to transition as much as we can to using electric cars so we are less reliant on the global volatility of the oil markets. I'd also like to pair that with more solar/wind electricity production, so we aren't as reliant on fossil fuels (you'll still need to use some, as we can't be ""100 percent green"" but there's a lot of leeway between the status quo and 100 percent green). In addition to the climate change aspects, we'd be less likely to depend on what Russia or Saudi Arabia or numerous other nations are doing. We'd still need to use plenty of oil for things we can't avoid and even if we said ""starting tomorrow, no new gas cars"" (we aren't and won't) it would still take 20-30 years or more to completely phase out gas, since cars stay on the road a long time. I don't miss the $4.50/gallon gas days and until we transition away from using oil so much, it will continue to ebb and flow no matter how much we drill or debate pipelines.",-0.58,Climate action critique,climate action critique,2022-02-08 16:50:13
12770,12770,10923,g61zitx,2qh1i,askreddit,False,1600651789,"Keep a disaster kit. Cell phone and cash. Earthquake- go outside away from structures- like into a field. Tsunami- Get far away from the coast and get to high ground. Tornado and Hurricane- Go to the basement. Usually go to the SW corner of the basement (in USA) as most tornado storms approach from the SW- climate change making this less predictable. Get to smallest room on first floor in any home with no basement- a room with lots of support walls like a bathroom. Get under a table, wear a helmet, away from windows, take water food flashlight blankets and supplies. Take a bible too if you're dumb.",-0.4404,Climate information,climate information,2020-09-21 01:29:49
12799,12799,10952,fc6iulo,2qh1i,askreddit,False,1577481619,I don't think that climate change has been stopped,-0.2263,Climate information,climate information,2019-12-27 21:20:19
12813,12813,10966,hffkjfp,2qh1i,askreddit,False,1633399941,"Why do you need to? Sparknotes version: the rich hoard their money offshore to avoid paying taxes, politicians are among the biggest offenders, some of it is illegal but most of it isn't, that doesn't matter because nothing's going to ever happen (except maybe the leaker dying or disappearing under mysterious circumstances). Oh, and they won't stop doing it, there will probably be another leak in another few years that will also lead to nothing, and so on and so forth until we get crushed by an asteroid or swallowed up by the rising floods caused by climate change. The end!",-0.7922,climate policy critique,climate policy critique,2021-10-05 02:12:21
12838,12838,10991,gvxi23q,2qh1i,askreddit,False,1619445721,"refugees, climate change, human rights violation in other countries, inhumane conditions and torture in prisons...",-0.7964,Climate information,climate information,2021-04-26 14:02:01
12847,12847,11000,hu4coh5,2qh1i,askreddit,False,1643090466,"A few messages: First, every important theorem, equation, and piece of chemistry I can remember, in every language I can. See if I can jumpstart humanity's knowledge. Second, our astronomical position. Star charts and that shit. Again, jumpstart knowledge. Third, explicit warnings regarding events that lead to dictatorships and awful scenarios. Especially the warning signs of fascism. See if I can avert some of humanity's most awful moments. Fourth, warn about climate change. Stress the importance of fighting it off. Ideally throw in other coverups and shit from companies, such as PFAS and teflon being absolutely awful. Fifth, ""WHAT WILL BE, WAS, WHAT WAS, WILL BE"". Sixth and finally, throw in some old as shit furry art.",-0.9765,climate change importance,climate change importance,2022-01-25 06:01:06
12872,12872,11025,fzbx2ks,2qh1i,askreddit,False,1595791918,"Probably not much, we are moving towards a bunch of unpleasant climate change related issues that will only make countries more war like. Famine, drought, mass migration.",-0.672,Climate information,climate information,2020-07-26 19:31:58
12875,12875,11028,ht6gxxv,2qh1i,askreddit,False,1642516007,"Climate Change, when we had the chance to stop it we didn't, now there's no way to stop it.",-0.1311,Climate information,climate information,2022-01-18 14:26:47
12884,12884,11037,h7gr57t,2qh1i,askreddit,False,1627932999,Climate change rendering the planet unhabitable,0.0,Climate information,climate information,2021-08-02 19:36:39
12885,12885,11038,frme7qr,2qh1i,askreddit,False,1590298385,Cost of living/education Climate change,0.0,Climate information,climate information,2020-05-24 05:33:05
12888,12888,11041,fsj7aj0,2qh1i,askreddit,False,1591024599,Climate change finally breaks earths equilibrium and the earth slowly get hotter and hotter (or colder and colder) and everyone dies by the end of the year.,0.0,Climate information,climate information,2020-06-01 15:16:39
12889,12889,11042,gmn60du,2qh1i,askreddit,False,1612830458,Something to take CO2 out of the atmosphere. I dread the day when climate change looms over civilization like the grim reaper,-0.7003,Climate information,climate information,2021-02-09 00:27:38
12892,12892,11045,hfp9f6l,2qh1i,askreddit,False,1633589008,"A lot of conspiracies stop being theories with time - Vaccine passports used to be a conspiracy theory, they are a reality in many places now - Chemtrails used to be a conspiracy theory, they are proposing them to fight climate change now - Vaccine mandates used to be a conspiracy theory, they had become a reality that is causing some people to even lose their careers - Gain of function research causing the pandemic use to be a conspiracy theory, it is now we'll accepted that's what caused it - That CNN, New York Times and MSNBC fabricated Russia Gate used to be a conspiracy theory. Now we know Clinton people was involved in that fabrication There are many more, but those are some recent ones.",-0.8591,climate activism,climate activism,2021-10-07 06:43:28
12901,12901,11054,igm6ef1,2qh1i,askreddit,False,1658128907,Celebrities. Couldn't give a toss what stripey top they've been seen out in or their thoughts on climate change,0.2023,Climate information,climate information,2022-07-18 07:21:47
12907,12907,11060,fz7rydh,2qh1i,askreddit,False,1595699700,Then they grab some old broken thermometer that has a 3 degree difference outside from what the weather channel is reporting and then they use that as evidence that climate change isn't real,-0.4767,Climate information,climate information,2020-07-25 17:55:00
12945,12945,11098,h7xy9qm,2qh1i,askreddit,False,1628262313,Probably make this branch of the galaxy habitable and if there are no aliens then I would make them. I'd probably correct the climate change crisis because we're supposed to be entering another ice age according to the last million or so years (based on gases trapped in Antarctic ice),-0.8658,Climate information,climate information,2021-08-06 15:05:13
12959,12959,11112,hj5yr27,2qh1i,askreddit,False,1635956537,"1st world: democracy is being replaced by corporate autacracy, half the citizens are cheering their demise as resources are more and more concentrated in the hands of the elite, until climate change and breakdown in shipping causes the majority class to fall into chaos. 3rd world: same but much much faster. they are absolutelt fucked in the next 20-30 years - drought, famine, war, platitutdes from USA and Europe that don't help, rinse and repeat.",-0.948,Climate action critique,climate action critique,2021-11-03 16:22:17
12967,12967,11120,hv757dq,2qh1i,askreddit,False,1643756037,"Adolf hitler, dude was trying to stop climate change before it was even a thing and we declared war on him",-0.7269,Climate information,climate information,2022-02-01 22:53:57
13002,13002,11155,fc0gaj2,2qh1i,askreddit,False,1577290174,"Yes, like climate change am I right?",0.6369,Climate information,climate information,2019-12-25 16:09:34
13027,13027,11180,hvh2alj,2qh1i,askreddit,False,1643923187,Climate change activists,,Climate information,climate information,2022-02-03 21:19:47
13037,13037,11190,hvg0qlj,2qh1i,askreddit,False,1643909187,"Currently, misinformation & greed. Long term, climate change & greed.",-0.7717,Climate information,climate information,2022-02-03 17:26:27
13067,13067,11220,h78xcsw,2qh1i,askreddit,False,1627768692,climate change and the environment. :woman_shrugging::exploding_head:,0.0,Climate information,climate information,2021-07-31 21:58:12
13096,13096,11249,fcobge5,2qh1i,askreddit,False,1577828157,"Almost certainly a thumbs down. ScoMo is Scott Morrison, the Australian Prime Minister. Who decided to take an unannounced vacation to Hawai'i when the bushfires broke out. And I think he's also a climate change denier. I don't think he's very popular with the Aussies around these parts at the moment.",-0.0258,Climate information,climate information,2019-12-31 21:35:57
13102,13102,11255,hdnk4sp,2qh1i,askreddit,False,1632180786,"A future free of climate change and war, If only for my kid.",-0.1531,Climate information,climate information,2021-09-20 23:33:06
13126,13126,11279,h2x9dob,2qh1i,askreddit,False,1624565202,Fix climate change on Earth and restore the environment,0.296,Climate information,climate information,2021-06-24 20:06:42
13135,13135,11288,hm6as9i,2qh1i,askreddit,False,1637947437,"If we could stop the corporate businesses from pumping out most of the pollution then we would see major positive changes in climate change but yeah, wishful thinking....",0.5642,Climate action critique,climate action critique,2021-11-26 17:23:57
13137,13137,11290,fgjm339,2qh1i,askreddit,False,1580846843,"Oh dear...I imagine a lot of those animals are undiscovered species, and now we may never discover them. Does anyone know why these fires started, other than just climate change? Will they ever stop? Is Australia going to become uninhabitable? Maybe what you need to do is put massive glass domes over areas that are not currently ablaze, and as more fires are extinguished, put more domes over the no-longer-burning areas.",-0.4098,Climate information,climate information,2020-02-04 20:07:23
13188,13188,11341,g6mbcb6,2qh1i,askreddit,False,1601095507,He believes in climate change and is willing to act on it. He's willing to increase taxes on billionaires. He's considered to be a very honorable person by people in both parties.,0.8313,climate policy critique,climate policy critique,2020-09-26 04:45:07
13203,13203,11356,h6ld8ss,2qh1i,askreddit,False,1627311757,We're well past the tipping point of climate change. At this point our impact on it is likely irreversible.,0.0772,Climate nihilism,climate nihilism,2021-07-26 15:02:37
