,Unnamed: 0,index,id,subreddit.id,subreddit.name,subreddit.nsfw,created_utc,body,sentiment,label,label_clean,created_datetime
3561,3561,1714,hqmiugr,2qh1i,askreddit,False,1640914310,"Even so, I feel like the majority of of people seem to agree on climate change, medical/education prices being too high, and individual rights, all of which are SO ENCOMPASSING. There is a major political party that has these values at the forefront of their policies. This political party is far from flawless, but compared to the other major political party, who's only interest seems to be obstruction and passing bills that put us back into the fucking stone age, they're practically a godsend. It just baffles me to see those who are all about many of these values and then actively vote against them. Makes no fuckin sense.",0.9781,climate policy critique,climate policy critique,2021-12-31 01:31:50
3564,3564,1717,i03mizt,2qh1i,askreddit,False,1646916440,Its gonna get worse. Climate change will cause massive migration events and refugee crises globally. Places like Bangladesh just won't exist anymore. Peterson is a Conservative he believes that by changing nothing life (and in fact going back in time) things will get better. They won't. We'll progress or die.,-0.6036,Climate information,climate information,2022-03-10 12:47:20
3582,3582,1735,h8upbwm,2qh1i,askreddit,False,1628900594,"Holy fucking shit humanity is fucked. Climate change, possibility of war. Why can't we all just live in a world that is truly fair",-0.8399,Climate information,climate information,2021-08-14 00:23:14
3601,3601,1754,h2gauqh,2qh1i,askreddit,False,1624213017,"Realizing that today nothing has ever been better in the world. If you think different, you consume too much news and social media. Eliminate all cable news (they are not for informing you). Eliminate Facebook, Instagram, Tiktok, and Twitter. If you use something like Twitter, carefully curate your feed. Reddit can be problematic too, but just like Twitter, you can carefully curate your feed. ​ Things to think about: Poverty is at the lowest rate it has ever been. World hunger is at the lowest it has ever been as food production is more than capable of feeding the population. If climate change freaks you out, realize even in the worst scientifically based predictions will not impact world food production. More data shows it'll increase food production similar to prior warm periods. ​ The rise of anxiety in people that I noticed in the last 20 years (I'm now 40) appears to correlate to being over socialized and connected. Humans really were not made for this. Also realizing that all these ""free"" services count on having some control to continue feeding data and selling it. PS: Politics has no place in every aspect of your life. And you can be friends, even close friends, with people you disagree with politically.",-0.0983,Climate information,climate information,2021-06-20 18:16:57
3681,3681,1834,hdkqb99,2qh1i,askreddit,False,1632134519,10 million dollars deposited into my savings account Climate change to reverse itself to a safe level All this covid bullshit to go away,-0.2263,Climate information,climate information,2021-09-20 10:41:59
3708,3708,1861,h8z6vz8,2qh1i,askreddit,False,1628989154,"Yeah, I save for retirement, despite the fact that I don't think our current financial system will still exist by the time I make it there. I'm also not convinced we're going to get our shit together to deal with climate change, so I don't necessarily think retirement is going to be something I make it to, but I'd rather have a good one than and bad one.",-0.2799,Climate information,climate information,2021-08-15 00:59:14
3764,3764,1917,hpm8n8p,2qh1i,askreddit,False,1640214643,Only 10 more years left before 10 more years to the end with Climate Change Same as it's been every 10 years since the 70's,0.0,Climate information,climate information,2021-12-22 23:10:43
3769,3769,1922,hgtcggg,2qh1i,askreddit,False,1634350541,"The fact that we as a species are barreling towards climate change that will have our descendants all but spitting in disgust at the mention of our names and there are too many greedy, selfish, short-sighted assholes, be they fossil fuel billionaires or morons who would rather eat a bullet than make meaningful sacrifices to their consumerism-driven lifestyles, to overcome right now.",-0.97,Climate information,climate information,2021-10-16 02:15:41
3780,3780,1933,iico8li,2qh1i,askreddit,False,1659247651,"It isn't possible to reverse the process of climate change. The average carbon footprint is 7,500kg per annum. The average tree absorbs 21kg per annum over its life span - about 30 years. 357 trees per person. Most people will live beyond 60 so 714 trees. At 2m^2 a tree, 1428m^2 or a sixth (0.15) of a hectare. Earths populations expected to be 10.2b by 2050, so 1.53b hectares. Just to offset any current emissions. Not to reverse the process, which would take double as many trees, at least. For reference the total land area of earth is 14.83b ha; we'd need to forest 10% of the earth's land mass just to offset our emissions, and excluding the fact that we are rapidly deforesting the forests we do have. Just to offset our current emissions. To reverse it we'd need to double that, at least. 20% more of the earth's land area being forested simply isn't going to happen. Also bearing in mind that somewhere around 30% of earth's land area is forest, there just isn't enough, and it's decreasing every year. AND deforestation is what got us here. Replanting 20% of the earth's land mass would put us on track but may still not be enough to support population growth.",0.7876,Climate information,climate information,2022-07-31 06:07:31
3788,3788,1941,haveu9v,2qh1i,askreddit,False,1630284751,"That the collapse of society is due sometime soon. Think years, not decades. It will most likely be climate change causing a combo of resource scarcity and mass migrations. It won't be like warmer at the equator and spread evenly like you might think. It's going to be sporadic - this hurricane coming to Louisiana is a pretty good example of things to come. More storms that are bigger and more often than ever, breaking records every single year. The most optimistic estimates show that we have around 20 years left before we major climate events happen. The most pessimistic start around now. Currently, there are massive fires and unprecedented storms. If we're smart, humanity is going to spend the rest of the century busting our ass learning how to terraform small domes so we can continue to exist. Unfortunately, we're not smart. There's also a huge global financial bubble bout to pop. Worldwide great depression. There's also a shit ton of regional disputes. Afghanistan, Israel, etc. When any ONE of these things pushes too hard in the wrong direction it will lead to conflict followed by probably war over resources. We don't have the time to develop technology to stop any of these problems - at the very least not to a scale we require. The only possible solution within the short time frame might be huge developments in AI but then we're probably going to have that to contend with as well. Not to mention big banks and Wall Street are already using what we have against us and the economy to get richer. Look at the amount of tension and conflict currently and this is while things are still relatively good. Does not bode well for the future...",-0.4852,Climate nihilism,climate nihilism,2021-08-30 00:52:31
3812,3812,1965,gtjy8kq,2qh1i,askreddit,False,1617704284,"I'm really not a conspiracy theorist. But i do believe a few things. The world is flat, vaccines are poison and climate change is obviously fake. I do stuff for Quanon, but im sure thats a normal thing. /s",-0.7123,Climate information,climate information,2021-04-06 10:18:04
3814,3814,1967,ht04d3b,2qh1i,askreddit,False,1642396616,That we only use 10% of our brains. Stranger danger. Satanic cults. Climate change denial. The D.A.R.E program. That Koko could actually communicate. Gang violence,-0.8176,Climate information,climate information,2022-01-17 05:16:56
3817,3817,1970,hk40xm2,2qh1i,askreddit,False,1636575183,The west was strong and high culture. Now it is woke BS and more and more degenerating. Trump meant the 80s when he said make America great again. Now we can see all over the western world the slowly downfall. While the east gets stronger but they are by far not so far evolved especially social political than we are. And all that in a time when climate change will kill everything. With the fall of the west and the upcoming of the east the world will end. And I don't believe in christianity but in the end of the bible where it is about the visions of one guy about the apocalypse he talked about the dragon coming up from the east (China) as a marker for that event.,-0.1779,Climate information,climate information,2021-11-10 20:13:03
3829,3829,1982,go56a51,2qh1i,askreddit,False,1613845989,Trump has the solution to climate change and income inequality. He just does not want those things. The solutions are not unknown. They just require the rich and others to make sacrifices and Trump will not sacrifice anything to help anyone else.,0.8433,Climate information,climate information,2021-02-20 18:33:09
3831,3831,1984,fzmwkpt,2qh1i,askreddit,False,1596041173,"Sorry but no. Dms to me seem like a waste of time. If you don't want to publicly like this i'll understand. Won't hold it against it. Like i said. You get much more leeway for being a teen then you would if you were a full on adult. Meaning a certain amount of automatic respect. With that said though. You again proved my point. You admitted that masks do help. When it comes to conservatives in general (odds are very good i've talked to more than you) there's a 100% they don't work at all being the mantra. You might say they pass through easily but the other part of your brain knows there's still some level of protection there. You haven't yet bought completely into conservative thinking yet. I do agree though. Both parties can and do get out of line sometimes. Problem is, when democrats get out of line no one ends up defending a cop that stood on someone's neck until they die horribly. When it comes to conservatives that happens constantly. And they should be working together. Hell, if they had worked together during the impeachment hearings there's a very good chance many of those 140,000 americans who are now dead....would still be alive. Because instead of protecting trump from being removed from office conservatives would have helped. Leading to research and playbooks on viruses and how to prepare the country for them being respected an heard. Same goes for climate change. The post office. Government assistance during a pandemic. Police reform. The literal constitution. Secret police. And a whole host of other things. America wouldn't be in the shitter right now had liberals and conservatives been able to work together. That's not on liberals though. Liberals are constantly getting in trouble with other liberals for trying to work with conservatives. And those conservatives regularly screw over liberals and conservatives afterward. Looking at that new...you can't sue your employer if they put you in unsafe working conditions thing conservatives are currently trying to pass. So yeah, you come from a good place. You're just wildly uninformed on what's happened, what's happening and what will happen.",0.9757,climate policy critique,climate policy critique,2020-07-29 16:46:13
3866,3866,2019,fteizzr,2qh1i,askreddit,False,1591646777,"If we don't take climate change seriously enough, progress in pretty much everything else could have been a total waste.",0.2975,Climate information,climate information,2020-06-08 20:06:17
3888,3888,2041,fkkzt5e,2qh1i,askreddit,False,1584295427,"1) Keep 5 Billion, and give the rest to people I care about so they never have to work again or worry about paying for their health care, and to people working on changing the world for the better. 2) Move somewhere without cold or snow. 3) Run in the sun every day (my favorite thing in life) 4) Spend as much of my alone time playing and developing games as I want. 5) Enjoy every second of my life doing whatever I feel like with the people who matter most to me. 6) I would consider running for President to deal with the issues that I feel matter most: preventing gun crime while protecting the second amendment; preventing pollution and climate change without crippling businesses; making sure that the richest corporations pay at least as much in taxes (percentage wise) as individuals; developing a healthcare system that doesn't deny basic healthcare for people who can't afford it, but doesn't hurt people who like their private insurance; keeping our military out of countries that don't want us involved and conflicts they can't win; bringing back the line between immigration and invasion; defending to the death freedom of speech; taking identity out of politics, so we can finally all stand together under only one banner: American!",0.8301,climate policy critique,climate policy critique,2020-03-15 18:03:47
3908,3908,2061,gazrs23,2qh1i,askreddit,False,1604400639,As one of the most influential countries in the world I'd like to see it take the lead on climate change and the environment. Lead by example.,0.6901,Climate information,climate information,2020-11-03 10:50:39
3915,3915,2068,ih993t6,2qh1i,askreddit,False,1658532854,"I accept that I have no control over it. I have no control over a lot of things. Somebody could run off the road and plow into me while I'm walking, no control. I eat food grown and packaged in God knows where, no control. I drink tap water, no control. Any of these things could kill me tomorrow. I could have an aneurysm in my sleep and die tonight. I could roll off the bed and break my neck. If this ""impending climate disaster"" is what they say, the groundwork for it has been laid for a over a century by people with a whole lot more money and influence than me. Me scrambling at the finish line isn't going to change it.",-0.9313,Climate information,climate information,2022-07-22 23:34:14
3923,3923,2076,h8hdnqv,2qh1i,askreddit,False,1628645054,It's why I don't have climate change induced anxiety cause what's the point worrying about things outside of your control.,-0.4767,Climate information,climate information,2021-08-11 01:24:14
3925,3925,2078,g16dgo6,2qh1i,askreddit,False,1597201793,"Methane hydrates. You think industrial carbon and agricultural methane are gunna fuck our planet up? You have no idea whats coming lol. Or, let me rephrase, is already occuring. The basic laymens gist is that there is vast, Vast, VAST amounts of frozen methane on the ocean floor. As the oceans heat the methane is released exponentially. Beside the fact that this methane will contribute to climate change about 1000× more potently than anything we have accomplished over the past however many years since the industrial revolution, it also dislodges MASSIVE amounts of ocean floor, causing huge underwater landslides that can cause ridiculously huge tsunamis and eradicate entire marine ecosystems. No idea why this isnt talked about more often. I assume because theres basically nothing we can do about it.",0.0,Climate nihilism,climate nihilism,2020-08-12 03:09:53
3927,3927,2080,hvk4l9e,2qh1i,askreddit,False,1643981608,"Hahaahahhah. The irony of calling me naive. ""Whos to say whats good or bad for earth?"" R u one of those climate change denialists? Also what about what we do to the trillions of animals we kill just for food mainly? Slavery has gone that way cuz it was supposed to go like that and suddenly thats ok? Goddamn u have to be trolling bruh",-0.9429,Climate information,climate information,2022-02-04 13:33:28
3944,3944,2097,gebb4ht,2qh1i,askreddit,False,1606866306,"It sure doesn't feel that way given the fact that older generations still don't allow us to change the world. Look at climate movements. Massive protests are the best our young generation can do, and the old white guys sitting hunched over their desks and microphones praise us but don't listen",0.6757,Climate information,climate information,2020-12-01 23:45:06
3950,3950,2103,ffu8k8a,2qh1i,askreddit,False,1580236750,Oh boy... - The Earth is flat - Vaccines cause autism - The moon landing was faked - Chemtrails are real - Climate change is a hoax,-0.2732,Climate denial,climate denial,2020-01-28 18:39:10
3952,3952,2105,hh3u22s,2qh1i,askreddit,False,1634563869,People who deny climate change,-0.34,Climate information,climate information,2021-10-18 13:31:09
3953,3953,2106,fbg7wsa,2qh1i,askreddit,False,1576838991,And the only way to do that effectively enough to stave off climate change is to effectively alter the current economy. changes nobody will see aren't enough to do that,0.7003,Climate information,climate information,2019-12-20 10:49:51
3974,3974,2127,i4u4vc5,2qh1i,askreddit,False,1650033606,"Climate Change Impacts. Most people have this thing where if they cant see it, or experience it in a short period of time, it's irrelevant. They continue building massive amounts of new housing in desert areas that are drought stricken and have been, and relay on bring water in that is already being fought over. And people buy them. The yearly increasing heat related deaths that will continue to rise exponentially, compounded by poorer or less developed areas no even having an electrical grid capable of handling more AC unit being run in homes they are available. India comes to mind. Areas that are not peoples own country somehow don't seem to matter to them either, like its not their problem, like their country is in its own bubble, when oh boy, it really will be everyone's problem one day. Real Estate still selling for huge amounts in areas that instead of being flooded every couple decades are now seeing bi yearly flooding. Along the coast, in City lowlands, etc. Oceans dying off in large areas. People really seem oblivious to this, the dying off of something that covers the majority of the planet, and we still know very little about. Absurd ice and snow storms in areas that never have them. Flooding from rains, bad in many places. The amount of fires each season now. Its all just happening a little to slowly for most people that have to focus on surviving to care. And the wealthy really don't GAF in most cases. It literally is at the point our Kids and Grandkids will be dealing with our failures. And sadly while enough people do care, the channels change needs to go through has its present self interest front and center. It's crazy to think about all the technological advances civilization has made in a century and with all we will knowingly be reeling and spiraling out of control in that time again.",-0.452,Climate information,climate information,2022-04-15 14:40:06
3992,3992,2145,gxkui4p,2qh1i,askreddit,False,1620625747,"""We denied climate change when we could have stopped relying on petroleum. Our people are going extinct as the ice age approaches. We did it to ourselves.""",-0.5859,Climate information,climate information,2021-05-10 05:49:07
3995,3995,2148,hll59nm,2qh1i,askreddit,False,1637546091,"Pharmaceutical industry, private prisons, governments, for profit police, the NRA, big alcohol and tobacco, anyone who makes BILLIONS off tax payers and then goes on to refuse or evade tax making mine more expensive, charities with ludicrous administration fees, social media, the Murdoch media, Fairfax media, fossil fuel companies that willingly covered up climate change knowing the damage they did, any company that refuses to raise minimum wage even though they make billions. Any company who donates to a political party to lobby for laws they want even if it's a bad choice for the people, irresponsible agriculture, big tech companies that create a monopoly, advertising companies, religious institutions that think they are above taxes even though they are worth trillions. Defence companies/contractors that purposely inflate wars for profit, predatory lenders, credit card companies. Telemarketing companies. Have a look at all of these things and the massive damage they combine to make, between all of the money these pigs get you could probably defeat world hunger and give them medical treatments. fucking disgusting. and they wonder why there is such mistrust, and hate towards machine built of poverty, sadness, corruption and human bodies on which the rich stand, pissing down on us.",-0.9608,climate policy critique,climate policy critique,2021-11-22 01:54:51
4005,4005,2158,g2onx55,2qh1i,askreddit,False,1598272023,"Food challenges due to the subtle 'climate changes' we are already experiencing. Adjustments being needed in agricultural production and practice will not keep pace and while there are not going to be food shortages what's available and when is going to change and present certain challenges.. people will be spending a greater percentage of there incomes to feed themselves also. In some parts of the country water is going to become a scarce commodity, and there will be protracted issues with water rights, usage, and conservation for decades. I think we have reached a peak in our over all standard of living and there is going to be a decline, slight in some ways but a decline none the less and its going to be harder on those who are young adults right now. It will also extentuate the divide between the wealthy and the working poor. Even the middle class and the poor. The social and political unrest we have now will seem mild in comparison. The next generation is going to have things a lot tougher over all than the last couple or the current coming of age generation.",-0.3612,Climate information,climate information,2020-08-24 12:27:03
4009,4009,2162,g3t691a,2qh1i,askreddit,False,1599107380,"The fact that this is so low in the thread proves the point at how few fucks people give. I scrolled this far to see if I was going to be the first to post about it. Sad indeed. I have an existential crisis every time I start to think about the horrors present and future from climate change, and the worst part is how few people care to do anything about it.",-0.9561,climate change importance,climate change importance,2020-09-03 04:29:40
4038,4038,2191,ffen476,2qh1i,askreddit,False,1579855360,"It's real. However, what is important to not is that when rapid changes in the climate to our atmosphere. We refer to [climate change]([URL] that is driven by human activities as anthropogenic climate change. If we don't get a handle on carbon emissions, the planet will do what it has always done. [This]([URL] is [objectively]([URL] [bad]([URL] for [human]([URL] [civilization]([URL] we are the cause, [we need to be the solution]([URL] Remember, [fixing it is good]([URL] and ""it's too late"" is [not]([URL] in [scientists]([URL] lexicon.",0.8823,Climate nihilism,climate nihilism,2020-01-24 08:42:40
4072,4072,2225,hq0r0qw,2qh1i,askreddit,False,1640523064,There's 10. 1. where's Jimmy Hotta's body? 2. Who shot JFK. 3. Where's Elvia 4. Who killed JonBennet Ramsey. 5. That the moon landing took place (yes I believe it did but fuck me there's a lot of idiots who don't) 6. That climate change is real (again yes I believe it's but fuck me there's a lot of idiots who don't). 7 wearing masks to protect against covid helps (for the same reasons as 5-7). 8. Disprove the existence of aliens at Area 51. 9. Where the fuck DB Cooper is. 10. Who the 2 people were that successfully escaped from Alcatraz.,-0.3612,Climate information,climate information,2021-12-26 12:51:04
4085,4085,2238,gjbtp8s,2qh1i,askreddit,False,1610702411,"Man-made climate change, moon landing, curvature of the Earth and gravity, vaccines without autism.",0.0,Climate information,climate information,2021-01-15 09:20:11
4153,4153,2306,i7cvlwh,2qh1i,askreddit,False,1651706283,"looking at the fucking shitshow that is the world right now with climate change and imagining what it's going to be like in 30 years. that, and looking at the shitshow that is the state of US politics causing me grave concern for the longevity of this nation... and if/when it crumbles, what will happen to global economy.",-0.0258,Climate information,climate information,2022-05-04 23:18:03
4172,4172,2325,idh7m4n,2qh1i,askreddit,False,1656017458,"I would bring something that would convince people that I am their god. I would then establish some rules that they'll need to follow, maybe tell them some secrets of the next 622 years. Now, what object did I bring? About 50 year ago, the world was having a plague pandemic and they still don't have any treatment but I do! I give them the treatment BUT, I tell them I am not satisfied with the way the way they have lived and that I curse them. For example, if you destroy earth I will curse you with climate change, The Spanish flu, Corona and even Nickelodeon (which won't be invented now) they I go back to my time and watch every praise me like a god.",-0.8776,Climate information,climate information,2022-06-23 20:50:58
4174,4174,2327,fnw4p9v,2qh1i,askreddit,False,1587311382,"Driving a car is not that same as directly paying for an animal on your plate and you're kidding yourself if you think it is. You're also assuming a lot about me - I fully understand the effect climate change is having on this world, and it is one of the reasons that I don't own a car dispute being perfectly capable of owning one. It's mad that you're using climate change caused by driving as an example, because animal agriculture is a huge contributor to climate change, as well as being hugely unethical.",0.2748,Climate information,climate information,2020-04-19 15:49:42
