,Unnamed: 0,index,id,subreddit.id,subreddit.name,subreddit.nsfw,created_utc,body,sentiment,label,label_clean,created_datetime
7268,7268,5421,hf9h4zz,2qh1i,askreddit,False,1633289798,"There is nothing than an individual can do about climate change. This applies to anyone from any nation. You can reduce your carbon footprint to zero and preach the same to everyone else. Industry, construction, governments, and shipping/travel put out more carbon in a second than your household will in a lifetime.",0.0,climate policy critique,climate policy critique,2021-10-03 19:36:38
7269,7269,5422,g95v5hs,2qh1i,askreddit,False,1602982292,Pseudoscientific arguments about climate change from Trump supporters.,0.0516,Climate information,climate information,2020-10-18 00:51:32
7304,7304,5457,gxy400k,2qh1i,askreddit,False,1620884167,"There are a few really interesting things you can do to other planets, even if you only have medium space-tech. You could position reflectors at the Lagrange-Points to redirect sunlight and cool the planet. Or you you do the same reversed and artificially heat the planet. It'd even be a viable method to control climate change - cost would be immense though. Probably not much higher compared to what climate change will cost us otherwise though.",0.6478,Climate information,climate information,2021-05-13 05:36:07
7319,7319,5472,h4i2djj,2qh1i,askreddit,False,1625768590,"Good: Better tech, greater acceptance and representation of sexual and ethnic minorites, as well as trans people, greater acceptance of others' hobbies and lifestyles (e.g. liking cartoons and comics as an adult isn't as 'frowned' upon, still got work to do though). Bad: Climate Change making weather more volatile, more expensive, income inequality getting worse (has been since the 80s), 24/7 news, political divide (remember when we used to have the Fairness Doctrine?). Frankly, all these aspects were already bad when I was a kid (born in the early '90s), they simply got worse.",0.7506,Climate information,climate information,2021-07-08 18:23:10
7366,7366,5519,ilitbvq,2qh1i,askreddit,False,1661296277,Do whatever you can to fight climate change and ocean pollution or else you won't have that first passion much longer.,0.1027,climate activism,climate activism,2022-08-23 23:11:17
7395,7395,5548,hrropof,2qh1i,askreddit,False,1641643629,Climate Change the biggest scam on the planet ever.,-0.5719,Climate denial,climate denial,2022-01-08 12:07:09
7401,7401,5554,gkqg8yo,2qh1i,askreddit,False,1611599173,"> You're criticizing these people for not giving away their entire networth, all the while you're not doing anything to try to help people who are in poverty. I explained what I'm doing to help out my fellow citizens. I cannot bring anyone out of poverty, because I am in poverty myself. I'm physically disabled. I've been denied any form of ongoing disability support despite have a doctor and specialist stating on the record that I am unable to work enough to support myself. I was living in my car until 8 months ago, and I'll be back in it when my Canadian COVID support payments run out. This horseshit about average people needed to do their part if they want to criticize billionaires is tired. It's the same as the idiots claiming that people just need to stop using single use plastics to reverse climate change instead of targeting the corporations that contribute 99.9 percent to it. It's just... dumb. Have a look at a previous comment thread I made about how ridiculous it is for lower or middle class people to be charitable when their ability absolutely pales in comparison to what the rich can do: [URL] > I asked what you do to try to help people in poverty and you reached so hard rather than just admitting you're not doing anything either. I can't even help myself out of poverty, haha. Don't worry Bezos, since I can't do anything, you don't have to. You're good, keep exploiting thousands and hoarding wealth like a dragon on its pile of gold. :thumbs_up: > There is plenty you can do to help people without spending money. And I showed you the ways I do that, you just moved the goalposts. You're pathetic. > (yeah I saw that you reposted my comment on some sub that makes fun of liberals - I don't identify as a liberal or with the left, or the right, fyi). Ah, my bad, should have posted to [SUBREDDIT:ENLIGHTENEDCENTRISM]. Liberal is not left wing, it's right wing. I am a leftist, and you pretend to not identify with the left or right while sitting firmly center-right. Educate yourself. > Make a choice - quit complaining or get up and make the world a better place. I'd rather just kill myself tbh.",-0.8539,Climate information,climate information,2021-01-25 18:26:13
7422,7422,5575,g857bz9,2qh1i,askreddit,False,1602187606,Realistically I think its probably gonna be nukes or climate change or both but ive always wanted to know what the end of the universe will be like,0.5023,Climate information,climate information,2020-10-08 20:06:46
7438,7438,5591,go7jk31,2qh1i,askreddit,False,1613895730,1. End world hunger. 2. stop climate Change 3. Replant burned forests 4. Get unlimited Steam/Nintendo eshop/etc... card 5. Get a ps5 6. Get a better gaming PC 7. Revive extinct animals 8. Build my dream House 9. Make a unlimited (climate friendly) Energy source that is super easly manifactured,0.9062,Climate information,climate information,2021-02-21 08:22:10
7448,7448,5601,h5cvii6,2qh1i,askreddit,False,1626406929,"Well, I don't care about being infertile. If I ever have kids, they'll be adopted. However, I don't know if I want to live for 500 years. Seeing everyone I love die, seeing the planet get totally fucked from climate change.......no. Let me live a normal human life, please.",-0.514,Climate information,climate information,2021-07-16 03:42:09
7451,7451,5604,h9onxtv,2qh1i,askreddit,False,1629479611,No what I'm saying is they will produce it in the cheapest and shittiest way they possibility can in order gain a larger profit. What this means is swapping over will not make a meaningful impact on climate change due to the methods of which they will use in the aforementioned countries. Since your argument was based around saving the environment I provided a counter method that you chose to interpret in bad faith.,-0.6664,Climate information,climate information,2021-08-20 17:13:31
7490,7490,5643,gpjcsqf,2qh1i,askreddit,False,1614782364,"Mentally prep myself on how to save this fucking planet out of climate collapse and capitalism because if I had unlimited money, I wouldn't fucking forgive myself if I didn't use it to fix the world. Like, building a ton of low income housing, straight up buying fossil fuel companies and other polluting companies and change how they work so that they become clean and green, even if they run at a loss. Buy a ton of media companies to manufacture consent. Buy a ton of politicians via funding or lobbying to ensure that things like single payer healthcare exists in every single country and just maybe we can get our fucking asses to a type 1 civilisation on the Kardashev scale.",0.7483,Climate nihilism,climate nihilism,2021-03-03 14:39:24
7516,7516,5669,hbtshih,2qh1i,askreddit,False,1630947307,"I am generally in favor of universal healthcare as a political issue, but right now I don't have a lot of faith in the United States government to accomplish much of anything, let alone to implement and manage what would likely be one of the biggest (if not THE biggest) government programs in history. We can't even get people to wear masks and get vaccinated during the worst global pandemic in 100 years, or to do anything about (or even fully acknowledge) climate change. Congress has been trying and failing to fund critically-needed infrastructure work -- an issue that isn't exactly a contentious political hot-button -- for so long that ""infrastructure"" has become a punchline in political circles. We're less than a year away from an attempted coup, and shockingly little has been done to bring the perpetrators to justice or to prevent such a thing from happening again. Is this a government you trust to devise, implement, and oversee a revolutionary health care system for 300+ million people?",0.9124,climate policy critique,climate policy critique,2021-09-06 16:55:07
7530,7530,5683,gy9n526,2qh1i,askreddit,False,1621121261,"That's also an extreme edge case, where few people would drive 500m, much less walk. It's super easy to pick out extreme cases like that and present them as ""No, but actually yes..."" evidence, while glossing over the frequency of that happening, and the likelihood that a sane person wouldn't change their behavior accordingly. The original comparison was Typical European Climate vs Typical US Climate, not ""Typical Stockholm Weather On A Typical Tuesday In December"" vs. ""Storm of the Decade In International Falls"". That said, I don't reject your evidence - My whole family hails from Minnesota originally - I do reject it's applicability in this discussion.",0.8748,Climate information,climate information,2021-05-15 23:27:41
7555,7555,5708,il4hqsl,2qh1i,askreddit,False,1661036116,I live there ya coont Cya then Also we're gonna drown thanks to climate change,-0.2023,Climate information,climate information,2022-08-20 22:55:16
7558,7558,5711,ibz9119,2qh1i,askreddit,False,1654958966,"I can confirm. Lived in several states and florida was by far the worst. It's super subtle, but there are alot of backroom deals and policies passed purely to funnel money into pockets. My favorite example was where govement employees would get fired if they showed details regarding increased beach errosion cause by climate change. Beaches are worth trillions in long term real estate. Imagine if a report said that property would disappear in 10 years.. Its not just upper goverment. Local goverment also approves fill land on reservoirs.. frequently leading to flooding during the next heavy rain.",0.6973,climate policy critique,climate policy critique,2022-06-11 14:49:26
7566,7566,5719,h9gq249,2qh1i,askreddit,False,1629327100,"Waiting for people to say ""climate change""",0.0,Climate information,climate information,2021-08-18 22:51:40
7616,7616,5769,honeuhx,2qh1i,askreddit,False,1639580075,"Not a climate scientist, I just stayed a Holiday inn express last night. There will be certain places that are going to be climate refuges like the Great lakes area. The climate will change there but it's predicted to be less extreme than most places.",0.6908,Climate information,climate information,2021-12-15 14:54:35
7653,7653,5806,foas6v8,2qh1i,askreddit,False,1587651593,"You can start the industrial revolution, but it will cause climate change and ultimately doom the species...",-0.5499,Climate information,climate information,2020-04-23 14:19:53
7668,7668,5821,gc0bxjm,2qh1i,askreddit,False,1605155311,Nothing. Not even the threat of boiling us all to death from climate change is enough to do much of any international cooperation. Nationalism will literally be the death of humanity,-0.7205,Climate action critique,climate action critique,2020-11-12 04:28:31
7677,7677,5830,i74rct0,2qh1i,askreddit,False,1651561620,"Political affairs play out within the confines of the constitution. The constitutions of most modern, democratic states inherently bar matters that would be an affront to the health and life of citizens from being political (i.e. a side other than the obvious one being taken seriously). So that would include the outlawing of abortion, acts contributing to climate change, and so forth. On the off chance that some state starts seeing these matters as political, it is a sign that something is very wrong in said state, possibly large swaths of the population being behind education-wise, or money being invested in ""making"" these matters political?",-0.101,climate policy critique,climate policy critique,2022-05-03 07:07:00
7749,7749,5902,hhm8p1u,2qh1i,askreddit,False,1634909345,"I fill shelves at a supermarket and a lot of still-good food gets thrown away due to expiration dates. At the supermarket I work at we have fresh bread, donuts, croissants etc. but all that is leftover in the evening has to be put in bags for later pickup. I think they use it as food for animals and stuff but if you want to eat it instead of throwing it away, you aren't allowed because it is ""stealing"". They call it stealing because you are eating unpaid food in the supermarket even if it gets thrown away otherwise. It always gets thrown away after the shop is already closed so no customer would ever buy it. It isn't going to get sold and the supermarket doesn't earn a profit no matter if we eat it or throw the food away. Some rules are just plain stupid and don't help prevent climate change but only cause it. And those rules for some reason don't get changed. Oh and the punishment for eating otherwise thrown away food is getting fired. No second chances.",-0.9902,Climate information,climate information,2021-10-22 13:29:05
7757,7757,5910,ge6n1mr,2qh1i,askreddit,False,1606768208,I wish astrology was the dumbest shit we had to deal with now in stead of covid denial and climate change denial.,-0.6369,Climate information,climate information,2020-11-30 20:30:08
7763,7763,5916,hv58m3g,2qh1i,askreddit,False,1643730615,"Most historians agree that WW1 was more or less inevitable due to the political/social climate in Europe leading up to it; with the assassination of Franz Ferdinand being the spark that already set off a very large and dry powder keg. The result of WW1, in our timeline, basically directly led to WW2. In my mind there are two ""simple"" ways you could prevent the European/African front of WW2. 1. Alter the Treaty of Versailles so it is not a punishment to the German people so extreme that it gave them no choice but to renege on it. This would remove a lot of the (justifiable) anger the German people had that the Nazis harnessed to gain power and march to war. I would especially include a stipulation that Germany does not lose any of it's home territory. As it is much harder to justify marching into and conquering a foreign nation than it is to retake territory that was German only ten years before. 2. Have Germany win WW1. Assuming they don't make the same mistake that the Brits/French made in the Treaty of Versailles. The Asian front of WW2 would be a lot harder to stop as that was kind of the WW1 of Asia. In that it was a result of over a hundred years of colonialization and social upheaval. In my mind the ""simplest"" way to stop WW2 in Asia would have been to ensure that China was strong/united enough to to resist Japanese aggression. But again, a change that ""simple"" would involve shifting hundreds if not thousands of events that led to the colonization of the far east which resulted in the Chinese Civil War that allowed Japan to attempt to swallow their neighbors. So much so I would say that Japan doing what it did was almost inevitable assuming they industrialize and the Europe/USA still colonizes the far east. I would also strongly protest against the idea that you could have stopped WW2 by killing Hitler. Hitler just happened to be in the right place at the right time with the right set of skills to seize the reins of power. WW2 would have looked different without Hitler, but it still would have happened. What I think is more up to debate is if you could have stopped the Holocaust by killing Hitler. There was unquestionably a environment of antisemitism post WW1 (because they are the western boogeyman to be blamed when anything goes wrong), but in my eyes it's questionable whether the Holocaust would have happened to the extent as it did with someone else at the reins.",-0.9911,Climate information,climate information,2022-02-01 15:50:15
7787,7787,5940,fbjeaqm,2qh1i,askreddit,False,1576931638,"He constantly insults people, unsigned the Paris accords, denies climate change, almost started a nucleair war and betrayed his allies but the turning point for you was him looking into an eclipse?",-0.775,Climate information,climate information,2019-12-21 12:33:58
7795,7795,5948,fi9w1jr,2qh1i,askreddit,False,1582284869,"""Mass genocide was a good thing. Could you imagine how escalated climate change would be if they were still here?"" Simplified what he actually said. Maybe not the stupidest but certainly the most fucked.",-0.3821,Climate information,climate information,2020-02-21 11:34:29
7846,7846,5999,h4t1j3f,2qh1i,askreddit,False,1626010223,"> forever Or until thawed by climate change, whichever comes first,",0.0,Climate information,climate information,2021-07-11 13:30:23
7855,7855,6008,i0g5jbc,2qh1i,askreddit,False,1647140506,"information, especially of a biased or misleading nature, used to promote or publicize a particular political cause or point of view. I think climate change is real but the definition fits.",-0.1857,Climate information,climate information,2022-03-13 03:01:46
7857,7857,6010,fwq4sgn,2qh1i,askreddit,False,1593715514,Fucking Climate change,,Climate information,climate information,2020-07-02 18:45:14
7860,7860,6013,feor5jt,2qh1i,askreddit,False,1579304297,"Climate change being instantly and irreversibly solved. This will allow me to have hope for my future, to aspire to someday have a baby without guilt, and will almost undoubtedly involve the dismantling of capitalism so my financial issues will become more manageable.",0.7727,Climate information,climate information,2020-01-17 23:38:17
7870,7870,6023,hgqw95q,2qh1i,askreddit,False,1634310546,"It's a weird question because just because I'm german doesn't mean I have the backwards world view of the nazis. It's weird when you think about all the terrible things done by the Germans in ww2 but it has nothing to do with me personally. Maybe this question is better answered by somebody who had a grandpa in the Wehrmacht or Waffen SS, but for me it's kind of irrelevant. What scares me though is that Europe in general is currently moving in a political direction to the right, it all started with the immigrant crisis in 2015 because then all the nazis who have been silent for years started to spreak up and spread their ignorant beliefs. We now have a right wing political party back in our Government called the AfD (alternative for Germany), which also deny the humane made climate change...",-0.8705,climate policy critique,climate policy critique,2021-10-15 15:09:06
7946,7946,6099,fjua3j0,2qh1i,askreddit,False,1583615052,"""Global warming"" Ecologist here with a background in anthropogenic disturbances (human-caused/related). It's not global warming (looking at you media), it's climate change. Some parts of the world/oceans likely will warm, others will cool. Some places likely will face greater extremes in their expected weather patterns, some places may face new/unprecedented weather patterns. ""All models are wrong. But some models are useful"". Calling it ""global warming"" is simply misleading.",0.3352,Climate information,climate information,2020-03-07 21:04:12
7965,7965,6118,hkr1nol,2qh1i,askreddit,False,1637001676,Climate change as the planet killer. Capitalism as the millennial finances killer. Idk,-0.875,Climate information,climate information,2021-11-15 18:41:16
7968,7968,6121,fistuot,2qh1i,askreddit,False,1582693190,How almost every person gets offended by every little thing when we could all just be working to better ourselves as human beings and slow down the time bomb called global warming/climate change,-0.3182,Climate information,climate information,2020-02-26 04:59:50
7976,7976,6129,h9ynub0,2qh1i,askreddit,False,1629670939,"I don't think it's fair to bring another person to this planet with the current and projected state of climate change, global politics, etc...",-0.2411,Climate information,climate information,2021-08-22 22:22:19
7984,7984,6137,fz5p0fh,2qh1i,askreddit,False,1595643553,"Yeah, for its size Norway is a rather large supporter of climate change.",0.5106,Climate information,climate information,2020-07-25 02:19:13
8032,8032,6185,fs4vqqt,2qh1i,askreddit,False,1590702951,"Faith is not blind obedience. It is an internal state, not behavior. You also make a universal assumption that all people of faith have not had experiences or thoughts that caused them to conclude that faith is the right choice for them. You are assuming that it is pure blind faith in all instances. For example, I personally was a vehement atheist as a young adult. Through a great deal of reflection on issues like the nature of consciousness, the universe, and science, I came to the conclusion (not an unequivocal one) that I think there is at least some element of intelligent design in the universe. I am sure you think that your perspective is on an absolute level more valid because it is ""based in science,"" however science as we currently know it does not have the tools to answer questions such as 1. how do we have consciousness, 2. how did something come from nothing, or if it the universe didn't come from nothing, how was there anything to begin with, 3. how should we live. Science isn't equipped to answer those questions, so it either postpones them until later, in which you blindly assume that they will eventually be answered, or it simply ignores them. So no I'm not just wrong, you're just trying to simplify the perspective of the other side to make this debate easier for you to win in your mind. And before you think that I'm socially anti-science, I am the children of parents with PhDs in chemistry, I am an economics major at a top 5 public university in the US, I fully believe that climate change is the #1 issue facing the world today, I am left-leaning, and I fully believe in the value of science. I just don't see it as contradictory with my spiritual beliefs, and an important part of that is that I don't subscribe to biblical inerrancy, meaning I don't literally think the Earth was created just a few thousand years ago or whatever.",0.9813,climate change importance,climate change importance,2020-05-28 21:55:51
8108,8108,6261,fccewbd,2qh1i,askreddit,False,1577597603,"It's more likely that they'll be too archaic to actually attack us. They evolved to infect single celled organisms. The source even states this. It'd be like someone from 3000 years ago in a horse drawn carriage trying to race a race car. It's possible for the former to win but it'd require some extraordinary circumstances. That being said, climate change is scary but for other, more significant reasons imo.",-0.1432,Climate information,climate information,2019-12-29 05:33:23
8136,8136,6289,h8ee34f,2qh1i,askreddit,False,1628595889,I'd have to say whatever executive at ExxonMobil saw we were destroying our planet and our future 40+ years ago and decided to keep waging a war on the environment for the sake of profit. We now have hordes of people who don't believe in climate change and don't want to do anything sustainable for the future just for the sake of the status quo.,-0.7024,Climate information,climate information,2021-08-10 11:44:49
8182,8182,6335,huti2yh,2qh1i,askreddit,False,1643521468,"I believe that we are so far gone as a species, that whether you support positive action towards climate change or not, that you will never make any real change. The only way forward is through our extinction.",0.743,Climate nihilism,climate nihilism,2022-01-30 05:44:28
8200,8200,6353,i3y1a6z,2qh1i,askreddit,False,1649448236,"Climate change isn't real. And if it is real, humans don't cause it. And if humans do cause it, it's not because of oil or meat consumption. (Just to be clear, climate change is real, and spiraling due to human actions)",0.3818,Climate action critique,climate action critique,2022-04-08 20:03:56
8236,8236,6389,fdsufs4,2qh1i,askreddit,False,1578708082,"Neoliberalism is a centre/centre-right political ideology that prioritizes markets and private industry over social accountability. They support capitalism. Capitalism supports the myth that ""the free market"" is king, and the failures of the free market are blamed more on individuals or groups of people than any systemic issues with the market system itself. This is usually to the benefit of large multinational corporations and the detriment of smaller local industries/most workers. For example, trade policies that export jobs abroad to cut corporate costs, while also leaving local workers high and dry. Another more pressing example, climate change in general is caused by corporations ignoring the negative externalities of doing business (ie pollution), and a lack of effort by neoliberal governments to hold corporations accountable for the damage they cause. Neoliberalism expects the market to find a solution, and might even deregulate the market in hopes that a less regulated market will find a solution (and not continue to maximize profits). This line of reasoning is equivalent to putting out a small house fire with a small bucket of water, and then blaming the same bucket when it fails to put out a larger house fire. As opposed to doing something reasonable like learning from the last and using a larger bucket/not building flammable houses to start with",-0.5106,climate policy critique,climate policy critique,2020-01-11 02:01:22
8250,8250,6403,g36uqpo,2qh1i,askreddit,False,1598658414,TOP 3 make or break issues/policy for me and Trump and Biden fail for all categorizes Climate Change will affect generations to come and we need to be tough (and franking is literally poisoning the air) Social Reform ( pro-BLM/ a fair justice system / pro Weed) Honestly I don't have a third make or break but I feel like I should care more about Healthcare reform . which I think Biden might actually do an incrementally better job then Trump.,0.9204,climate activism,climate activism,2020-08-28 23:46:54
